<?xml version="1.0"?>
<!--
/**
 * Maho
 *
 * @package     default_default
 * @copyright   Copyright (c) 2006-2020 Magento, Inc. (https://magento.com)
 * @copyright   Copyright (c) 2022 The OpenMage Contributors (https://openmage.org)
 * @copyright   Copyright (c) 2024-2026 Maho (https://mahocommerce.com)
 * @license     https://opensource.org/licenses/afl-3.0.php  Academic Free License (AFL 3.0)
 */
-->

<layout xmlns:xsi="http://www.w3.org/2001/XMLSchema-instance"
        xsi:noNamespaceSchemaLocation="../../../../../../lib/Maho/Schema/layout.xsd">
    <adminhtml_widget_index>
        <block name="wysiwyg_widget" type="widget/adminhtml_widget" output="toHtml" />
    </adminhtml_widget_index>

    <adminhtml_widget_loadoptions>
        <block name="wysiwyg_widget.options" type="widget/adminhtml_widget_options" output="toHtml" />
    </adminhtml_widget_loadoptions>

    <adminhtml_widget_instance_index>
        <reference name="content">
            <block type="widget/adminhtml_widget_instance" name="widget_instance" />
        </reference>
    </adminhtml_widget_instance_index>

    <adminhtml_widget_instance_edit>
        <reference name="head">
            <action method="addJs"><script>mage/adminhtml/wysiwyg/widget.js</script></action>
            <action method="addItem"><type>js</type><name>maho-dialog.js</name></action>
            <action method="addItem"><type>js</type><name>maho-tree.js</name></action>
        </reference>
        <reference name="content">
            <block type="widget/adminhtml_widget_instance_edit" name="widget_instance_edit" />
        </reference>
        <reference name="left">
            <block type="widget/adminhtml_widget_instance_edit_tabs" name="widget_instance_edit_tabs">
                <block type="widget/adminhtml_widget_instance_edit_tab_settings" name="widget_instance_edit_tab_settings" />
                <block type="widget/adminhtml_widget_instance_edit_tab_main" name="widget_instance_edit_tab_main" />
                <block type="widget/adminhtml_widget_instance_edit_tab_properties" name="widget_instance_edit_tab_properties" />
                <action method="addTab"><name>settings_section</name><block>widget_instance_edit_tab_settings</block></action>
                <action method="addTab"><name>main_section</name><block>widget_instance_edit_tab_main</block></action>
                <action method="addTab"><name>properties_section</name><block>widget_instance_edit_tab_properties</block></action>
            </block>
        </reference>
        <reference name="js">
            <block type="adminhtml/template" template="widget/instance/js.phtml" name="widget_instance_js"></block>
        </reference>
    </adminhtml_widget_instance_edit>
</layout>
