<?xml version="1.0"?>
<!--
/**
 * Maho
 *
 * @package     base_default
 * @copyright   Copyright (c) 2006-2020 Magento, Inc. (https://magento.com)
 * @copyright   Copyright (c) 2022 The OpenMage Contributors (https://openmage.org)
 * @license     https://opensource.org/licenses/afl-3.0.php  Academic Free License (AFL 3.0)
 */

-->
<layout xmlns:xsi="http://www.w3.org/2001/XMLSchema-instance"
        xsi:noNamespaceSchemaLocation="../../../../../../lib/Maho/Schema/layout.xsd" version="0.1.0">
<!--
Default layout, loads most of the pages
-->
    <catalog_product_view>
        <update handle="MAP_price_msrp_item" />
    </catalog_product_view>
    <wishlist_index_index>
        <update handle="MAP_price_msrp_wishlist_item" />
    </wishlist_index_index>
    <wishlist_shared_index>
        <update handle="MAP_price_msrp_wishlist_item" />
    </wishlist_shared_index>
    <review_product_list>
        <update handle="MAP_price_msrp_item" />
    </review_product_list>

    <default>
        <reference name="head">
            <action method="addItem" ifconfig="sales/msrp/enabled"><type>skin_js</type><name>js/msrp.js</name></action>
        </reference>
        <reference name="content">
            <block type="core/template" template="catalog/msrp/popup.phtml" name="product.tooltip"></block>
        </reference>
    </default>
    <MAP_price_msrp_item>
        <reference name="catalog_product_price_template">
            <action method="addPriceBlockType"><type>msrp</type><block>catalog/product_price</block><template>catalog/product/price_msrp_item.phtml</template></action>
        </reference>
        <reference name="product.clone_prices">
            <action method="addPriceBlockType"><type>msrp</type><block>catalog/product_price</block><template>catalog/product/price_msrp_item.phtml</template></action>
        </reference>
    </MAP_price_msrp_item>
    <MAP_price_msrp_wishlist_item>
        <reference name="catalog_product_price_template">
            <action method="addPriceBlockType"><type>msrp</type><block>catalog/product_price</block><template>wishlist/render/item/price_msrp_item.phtml</template></action>
        </reference>
    </MAP_price_msrp_wishlist_item>
    <default>
        <reference name="catalog_product_price_template">
            <action method="addPriceBlockType"><type>msrp</type><block>catalog/product_price</block><template>catalog/product/price_msrp.phtml</template></action>
            <action method="addPriceBlockType"><type>msrp_item</type><block>catalog/product_price</block><template>catalog/product/price_msrp_item.phtml</template></action>
            <action method="addPriceBlockType"><type>msrp_noform</type><block>catalog/product_price</block><template>catalog/product/price_msrp_noform.phtml</template></action>
        </reference>
    </default>
</layout>
