<?xml version="1.0"?>
<!--
/**
 * Maho
 *
 * @package     base_default
 * @copyright   Copyright (c) 2006-2020 Magento, Inc. (https://magento.com)
 * @copyright   Copyright (c) 2022 The OpenMage Contributors (https://openmage.org)
 * @copyright   Copyright (c) 2024-2026 Maho (https://mahocommerce.com)
 * @license     https://opensource.org/licenses/afl-3.0.php  Academic Free License (AFL 3.0)
 */

-->
<layout xmlns:xsi="http://www.w3.org/2001/XMLSchema-instance"
        xsi:noNamespaceSchemaLocation="../../../../../../lib/Maho/Schema/layout.xsd" version="0.1.0">

    <shipping_tracking_ajax>
        <reference name="root">
            <action method="setTemplate"><template></template></action>
        </reference>
        <reference name="content">
            <block type="shipping/tracking_ajax" name="shipping.tracking.ajax" template="shipping/tracking/ajax.phtml" />
        </reference>
    </shipping_tracking_ajax>
    <shipping_tracking_popup translate="label">
        <label>Shipment Tracking Popup</label>
        <reference name="root">
            <action method="setTemplate"><template>page/popup.phtml</template></action>
        </reference>
        <reference name="content">
            <block type="shipping/tracking_popup" name="shipping.tracking.popup" template="shipping/tracking/popup.phtml" />
        </reference>
    </shipping_tracking_popup>
</layout>

