<?xml version="1.0"?>
<!--
/**
 * Maho
 *
 * @package     base_default
 * @copyright   Copyright (c) 2006-2020 Magento, Inc. (https://magento.com)
 * @copyright   Copyright (c) 2022-2024 The OpenMage Contributors (https://openmage.org)
 * @copyright   Copyright (c) 2024-2026 Maho (https://mahocommerce.com)
 * @license     https://opensource.org/licenses/afl-3.0.php  Academic Free License (AFL 3.0)
 */

-->
<layout xmlns:xsi="http://www.w3.org/2001/XMLSchema-instance"
        xsi:noNamespaceSchemaLocation="../../../../../../lib/Maho/Schema/layout.xsd" version="0.1.0">

    <default>
        <reference name="header">
            <block type="core/template" name="top.search" as="topSearch" template="catalogsearch/form.mini.phtml"/>
        </reference>
        <reference name="footer_links">
            <action method="addLink" translate="label title" module="catalogsearch" ifconfig="catalog/advanced_search/enabled">
                <label>Advanced Search</label>
                <url helper="catalogsearch/getAdvancedSearchUrl" />
                <title>Advanced Search</title>
            </action>
        </reference>
    </default>

    <catalogsearch_result_index translate="label">
        <label>Quick Search Form</label>
        <reference name="root">
            <action method="setTemplate"><template>page/2columns-left.phtml</template></action>
        </reference>
        <reference name="left_first">
            <block type="catalogsearch/layer" name="catalogsearch.leftnav" after="currency" template="catalog/layer/view.phtml">
                <block type="core/text_list" name="catalog.leftnav.state.renderers" as="state_renderers" />
            </block>
        </reference>
        <reference name="content">
            <block type="catalogsearch/result" name="search.result" template="catalogsearch/result.phtml">
                <block type="catalog/product_list" name="search_result_list" template="catalog/product/list.phtml">
                    <block type="core/text_list" name="product_list.name.after" as="name.after" />
                    <block type="core/text_list" name="product_list.after" as="after" />
                    <block type="catalog/product_list_toolbar" name="product_list_toolbar" template="catalog/product/list/toolbar.phtml">
                        <block type="page/html_pager" name="product_list_toolbar_pager"/>
                    </block>
                    <action method="addColumnCountLayoutDepend"><layout>empty</layout><count>6</count></action>
                    <action method="addColumnCountLayoutDepend"><layout>one_column</layout><count>5</count></action>
                    <action method="addColumnCountLayoutDepend"><layout>two_columns_left</layout><count>4</count></action>
                    <action method="addColumnCountLayoutDepend"><layout>two_columns_right</layout><count>4</count></action>
                    <action method="addColumnCountLayoutDepend"><layout>three_columns</layout><count>3</count></action>
                    <action method="setToolbarBlockName"><name>product_list_toolbar</name></action>
                </block>
                <action method="setListOrders"/>
                <action method="setListModes"/>
                <action method="setListCollection"/>
            </block>
        </reference>
    </catalogsearch_result_index>

    <catalogsearch_advanced_index translate="label">
        <label>Advanced Search Form</label>
        <!-- Mage_CatalogSearch -->
        <reference name="root">
            <action method="setTemplate"><template>page/2columns-right.phtml</template></action>
        </reference>
        <reference name="head">
            <action method="setTitle" translate="title" module="catalogsearch"><title>Advanced Search</title></action>
        </reference>
        <reference name="content">
            <block type="catalogsearch/advanced_form" name="catalogsearch_advanced_form" template="catalogsearch/advanced/form.phtml"/>
        </reference>
    </catalogsearch_advanced_index>

<!--
Advanced search results
-->

    <catalogsearch_advanced_result translate="label">
        <label>Advanced Search Result</label>
        <update handle="page_two_columns_right" />
        <!-- Mage_CatalogSearch -->
        <reference name="root">
            <action method="setTemplate"><template>page/2columns-right.phtml</template></action>
        </reference>
        <reference name="content">
            <block type="catalogsearch/advanced_result" name="catalogsearch_advanced_result" template="catalogsearch/advanced/result.phtml">
                <block type="catalog/product_list" name="search_result_list" template="catalog/product/list.phtml">
                    <block type="core/text_list" name="product_list.name.after" as="name.after" />
                    <block type="core/text_list" name="product_list.after" as="after" />
                    <block type="catalog/product_list_toolbar" name="product_list_toolbar" template="catalog/product/list/toolbar.phtml">
                        <block type="page/html_pager" name="product_list_toolbar_pager"/>
                    </block>
                    <action method="addColumnCountLayoutDepend"><layout>empty</layout><count>6</count></action>
                    <action method="addColumnCountLayoutDepend"><layout>one_column</layout><count>5</count></action>
                    <action method="addColumnCountLayoutDepend"><layout>two_columns_left</layout><count>4</count></action>
                    <action method="addColumnCountLayoutDepend"><layout>two_columns_right</layout><count>4</count></action>
                    <action method="addColumnCountLayoutDepend"><layout>three_columns</layout><count>3</count></action>
                    <action method="setToolbarBlockName"><name>product_list_toolbar</name></action>
                </block>
                <action method="setListOrders"/>
                <action method="setListModes"/>
                <action method="setListCollection"/>
            </block>
        </reference>
    </catalogsearch_advanced_result>

</layout>
