<?xml version="1.0"?>
<!--
/**
 * Maho
 *
 * @package     base_default
 * @copyright   Copyright (c) 2006-2020 Magento, Inc. (https://magento.com)
 * @copyright   Copyright (c) 2022 The OpenMage Contributors (https://openmage.org)
 * @license     https://opensource.org/licenses/afl-3.0.php  Academic Free License (AFL 3.0)
 */

-->
<layout xmlns:xsi="http://www.w3.org/2001/XMLSchema-instance"
        xsi:noNamespaceSchemaLocation="../../../../../../lib/Maho/Schema/layout.xsd" version="0.1.0">
    <default>
        <!-- Mage_Reports -->
        <reference name="right">
            <block type="reports/product_viewed" before="right.permanent.callout" name="right.reports.product.viewed" template="reports/product_viewed.phtml" />
            <block type="reports/product_compared" before="right.permanent.callout" name="right.reports.product.compared" template="reports/product_compared.phtml" />
        </reference>
    </default>

    <catalog_category_layered_nochildren translate="label">
        <label>Catalog Category (Without Subcategories)</label>
        <remove name="right.reports.product.viewed" />
        <reference name="right">
            <block type="reports/product_viewed" before="right.permanent.callout" name="left.reports.product.viewed" template="reports/product_viewed.phtml" />
        </reference>
    </catalog_category_layered_nochildren>
</layout>
